{"owner_approval":null,"payload":{"approval_status":"PENDING_OWNER_HASH_APPROVAL","base_canon_hash":"d7ceea75615b57970f3b9712b73ed4c9f65a9c4406c877e9013470cb53a6141a","base_commit":"e90a717d3863e4fb0e5e1a0fcc01661f24d2157d","base_tree":"7a1ce74ad0b82c7c288b94c47c966028e916137d","candidate_binding":{"candidate_commit":null,"candidate_tree":null,"strategy":"EXACT_HEAD_AT_VALIDATION"},"change_set_id":"CS-R2-SC-GOV-INSTALL-001","merkle_root":"5b9e417209beab3dc88ed305a79b8945512d4c0e842397e5494885ac4dd3a23e","proposed_canon_hash":"d7ceea75615b57970f3b9712b73ed4c9f65a9c4406c877e9013470cb53a6141a","receipt_id":"RR-SC-GOV-INSTALL-RECEIPT-001","schema_version":"1.0.0","source_package_id":"RR-SC-GOV-V2-Q001-Q130","source_package_sha256":"158e6e82e50ae4a411b780e718f16353dd668b6f94320c685a95d20d766d0e36"},"payload_hash":"5d348a937de063ba66922258c54a8bfc4a83fc3539d559916afb7f6a9bb2fb9e","schema_version":"1.0.0"}
